{
  "$schema": "https://json-schema.org/draft/2020-12/schema",
  "title": "Манифест продукта HomenS.AI, версия 1",
  "type": "object",
  "additionalProperties": false,
  "required": ["schema_version", "product_name", "product_id", "port", "data_home_env", "migration_command", "healthcheck_url", "archive_before_replace", "docker"],
  "properties": {
    "schema_version": {"type": "integer", "const": 1},
    "product_name": {"type": "string", "minLength": 1, "maxLength": 128, "pattern": "^[^\\u0000-\\u0020\\u007f](?:[^\\u0000-\\u001f\\u007f]*[^\\u0000-\\u0020\\u007f])?(?![\\s\\S])"},
    "product_id": {"type": "string", "minLength": 1, "maxLength": 63, "pattern": "^[a-z0-9][a-z0-9_-]*(?![\\s\\S])"},
    "port": {"type": "integer", "minimum": 1024, "maximum": 65535},
    "data_home_env": {"type": "string", "minLength": 1, "maxLength": 128, "pattern": "^[A-Z][A-Z0-9_]*(?![\\s\\S])"},
    "migration_command": {"$ref": "#/$defs/command"},
    "healthcheck_url": {"type": "string", "maxLength": 2048, "pattern": "^http://127\\.0\\.0\\.1:[1-9][0-9]{3,4}/[A-Za-z0-9/_.~-]*(?![\\s\\S])"},
    "archive_before_replace": {"type": "boolean", "const": true},
    "docker": {
      "type": "object",
      "additionalProperties": false,
      "required": ["base_image", "start_command"],
      "properties": {
        "base_image": {"type": "string", "maxLength": 512, "pattern": "^(?:[a-z0-9]+(?:[.-][a-z0-9]+)*(?::[1-9][0-9]*)?/)?[a-z0-9]+(?:[._-][a-z0-9]+)*(?:/[a-z0-9]+(?:[._-][a-z0-9]+)*)*(?::[A-Za-z0-9_][A-Za-z0-9_.-]*)?@sha256:[a-f0-9]{64}(?![\\s\\S])"},
        "start_command": {"$ref": "#/$defs/command"}
      }
    }
  },
  "$defs": {
    "command": {
      "type": "array",
      "minItems": 1,
      "maxItems": 64,
      "items": {"type": "string", "minLength": 1, "maxLength": 4096, "pattern": "^[^\\u0000-\\u001f\\u007f]+(?![\\s\\S])"}
    }
  }
}
